"Counter: Marinescu2023","Counter: Bharti2024","Counter: Amalarethinam2024","Counter: Surianarayanan2023","Counter: Humayun2022","Counter: Wali2024","Counter Sum: Pub1","Counter Sum: Pub2","Counter: CSA2024","Counter: PaloAlto2024","Counter: CrowdStrike2023","Counter: SentinelOne2024","Counter Sum: Report1","Counter Sum: Report2","Category of Objects","Object","Threat","Attack","Vulnerability","Layer in shared responsibility model by CSA","Is API-related","Configuration","IAM","Data","Networking","Application","Runtime","Middleware","OS","Virtualization","Servers","Storage","Physical Security","Check: Is in top 3 threat categories (IAM, API, Misconfigurations)","MITRE ATT&CK number","MITRE ATT&CK name","Is threat category","CSP is fully responsible","No cloud-specific threat","Is malware-type","On-Prem"
1,,,2,,,3,2,2,,1,,3,2,"Misconfigurations; Insecure interfaces and APIs","Disable(d)/misconfigure(d) monitoring and logging (on a heterogeneous workload system)",TRUE,TRUE,TRUE,"Configuration",,TRUE,"","","","","","","","","","","","TRUE","T1562.008","Impair Defenses: Disable or Modify Cloud Logs",,,,,
1,,,,,,1,1,,,3,,3,1,"Privilege escalation; Initial access; Image sharing","Recover sensitive information, e.g. Files containing credentials and private keys",TRUE,TRUE,,"IAM, Data, Configuration",,TRUE,TRUE,TRUE,"","","","","","","","","","TRUE","T1530; T1552; T1552.001","Data from Cloud Storage; Unsecured Credential; Unsecured Credentials: Credentials In Files",,,,,
1,,,,,,1,1,1,,,,1,1,"Data loss","Alteration or deletion of data/records (without maintaining backup)",TRUE,TRUE,,"Data, Configuration",,TRUE,"",TRUE,"","","","","","","","","","TRUE","T1565.001; T1485","Data Destruction; Data Manipulation: Stored Data Manipulation",,,,,
,,,,,,0,0,,,1,,1,1,"Lateral movement","Leveraging cloud orchestration tools",TRUE,TRUE,,"Configuration",,TRUE,"","","","","","","","","","","","TRUE","T1578","Modify Cloud Compute Infrastructure",,,,,
1,,,,,,1,1,,,,,0,0,,"Resource exhaustion caused by imprecise specification of user needs or incorrect evaluation of user specification",TRUE,TRUE,,"Configuration",,TRUE,"","","","","","","","","","","","TRUE","T1499","Endpoint Denial of Service",,,,,
,1,,,,,1,1,,,,,0,0,,"Unconfident VM relocation",TRUE,TRUE,,"Configuration",,TRUE,"","","","","","","","","","","","TRUE","T1578.005","Modify Cloud Compute Infrastructure: Modify Cloud Compute Configurations",,,,,
,,,,,,0,0,,,2,,2,1,"Defense evasion","Impair defenses/Deactivating security products",TRUE,TRUE,,"Configuration",,TRUE,"","","","","","","","","","","","TRUE","T1562.001; T1562.007","Impair Defenses: Disable or Modify Tools; Impair Defenses: Disable or Modify Cloud Firewall",,,,,
,,,,,,0,0,,,1,,1,1,"Defense evasion","Build image on host",TRUE,TRUE,,"Configuration",,TRUE,"","","","","","","","","","","","TRUE","T1612; T1578.002","Build Image on Host; Modify Cloud Compute Infrastructure: Create Cloud Instance",,,,,
,,,,,,0,0,,,2,,2,1,"Defense evasion","Naming newly created workloads to align with naming scheme",TRUE,TRUE,,"Configuration",,TRUE,"","","","","","","","","","","","TRUE","T1036.005","Masquerading: Match Legitimate Name or Location",,,,,
1,,,,,,1,1,,,,,0,0,"User - attacked by service","SSL certificate spoofing",TRUE,TRUE,,"Networking, Configuration",,TRUE,"","",TRUE,"","","","","","","","","TRUE","T1588.004","Obtain Capabilities: Digital Certificates",,,,,
,,,,,,0,0,1,,,,1,1,,"DNS attacks",TRUE,TRUE,,"Networking, Configuration",,TRUE,"","",TRUE,"","","","","","","","","TRUE","T1071.004","Application Layer Protocol: DNS",,,,,
2,,,,,,2,1,,,,,0,0,,"Distribute spam and malware (malware proliferation)",TRUE,TRUE,,"IAM, Application",,"",TRUE,"","",TRUE,"","","","","","","","TRUE","T1585.002; T1566.001","Establish Accounts: Email Accounts; Phishing: Spearphishing Attachment",,,,,
5,4,,,,,9,2,,,,1,1,1,,"Account hijacking / compromised accounts",TRUE,TRUE,,"IAM",,"",TRUE,"","","","","","","","","","","TRUE","T1078.004; T1078.001","Valid Accounts: Cloud Accounts; Valid Accounts: Default Accounts",,,,,
,,,,,,0,0,1,,,,1,1,"IAM","Impersonation",TRUE,TRUE,,"IAM",,"",TRUE,"","","","","","","","","","","TRUE","T1656","Impersonation",,,,,
,1,,,,,1,1,,,,,0,0,,"Password guessing attacks (brute force attacks and dictionary attacks)",TRUE,TRUE,,"IAM",,"",TRUE,"","","","","","","","","","","TRUE","T1110.001","Brute Force: Password Guessing",,,,,
,,1,,,,1,1,,,1,,1,1,,"Password reset attack",TRUE,TRUE,,"IAM",,"",TRUE,"","","","","","","","","","","TRUE","T1098.001","Account Manipulation: Additional Cloud Credentials",,,,,
,,,,,,0,0,,,1,,1,1,"Privilege escalation","By resetting existing credentials",TRUE,TRUE,,"IAM",,"",TRUE,"","","","","","","","","","","TRUE","T1098.001; T1098.004","Account Manipulation: Additional Cloud Credentials; Account Manipulation: SSH Authorized Keys",,,,,
1,,,,,,1,1,,,,,0,0,"Reason for risk","Malicious mobile applications bypassing access control mechanisms",TRUE,TRUE,,"IAM",,"",TRUE,"","","","","","","","","","","TRUE","T1556","Modify Authentication Process",,,,,
2,1,2,,1,,6,4,1,,,,1,1,"Traditional security threats","Phishing",TRUE,TRUE,,"IAM",,"",TRUE,"","","","","","","","","","","TRUE","T1566","Phishing",,,,,
,,,1,,,1,1,1,,,,1,1,"IAM","Replay attack (e.g. on password)",TRUE,TRUE,,"IAM",,"",TRUE,"","","","","","","","","","","TRUE","T1212","Exploitation for Credential Access",,,,,
1,,,,,,1,1,,,,,0,0,,"Backdoors and leftover credentials",TRUE,TRUE,,"OS, Middleware, Runtime, Application, Data",,"","",TRUE,"",TRUE,TRUE,TRUE,TRUE,"","","","","","T1552.001","Unsecured Credentials: Credentials In Files",,,,,
1,,,,,,1,1,,,,,0,0,,"Access VM-logging files and, thus, recover sensitive data",TRUE,TRUE,,"Data",,"","",TRUE,"","","","","","","","","","","T1654","Log Enumeration",,,,,
,4,,2,1,1,8,4,8,1,,,9,2,"Malicious Insider attack","Access/Expose sensitive data",TRUE,TRUE,,"Data",,"","",TRUE,"","","","","","","","","","",,,,,,,
6,2,3,2,,3,16,5,1,,,1,2,2,,"DoS/DDoS attack",TRUE,TRUE,,"Networking, Application",,"","","",TRUE,TRUE,"","","","","","","","","T1499; T1498","Endpoint Denial of Service; Network Denial of Service ",,,,,
1,,,,,,1,1,,,,,0,0,,"Avoid VM honey pots designed to study the methods of attack",TRUE,TRUE,,"Networking",,"","","",TRUE,"","","","","","","","","","None",,,,,,
1,,1,,,1,3,3,,,,,0,0,"Network security","Sniffing",TRUE,TRUE,,"Networking",,"","","",TRUE,"","","","","","","","","","T1040","Network Sniffing",,,,,
1,,1,,,1,3,3,,,,,0,0,"Network security","Traffic eavesdropping",TRUE,TRUE,,"Networking",,"","","",TRUE,"","","","","","","","","","T1040","Network Sniffing",,,,,
,,1,,,,1,1,,,,,0,0,"Network security","Traffic Snooping",TRUE,TRUE,,"Networking",,"","","",TRUE,"","","","","","","","","","T1040","Network Sniffing",,,,,
2,,,,,2,4,2,,,,,0,0,"Malicious external attackers use","Spoofing",TRUE,TRUE,,"Networking",,"","","",TRUE,"","","","","","","","","","T1656","Impersonation",,,,,
,,,,,,0,0,1,,,,1,1,"Misconfigurations; DNS attacks","Subdomain hijacking (aka dangling DNS)",TRUE,TRUE,,"Networking, Configuration",,TRUE,"","",TRUE,"","","","","","","","","TRUE","T1584.001","Compromise Infrastructure: Domains",,,,,
3,2,1,1,1,2,10,6,,,,1,1,1,,"(Cloud-related) malware injection attack",TRUE,TRUE,,"OS, Middleware, Runtime, Application",,"","","","",TRUE,TRUE,TRUE,TRUE,"","","","","","T1204.002","User Execution: Malicious File",,,,,
,,,,,,0,0,,,1,,1,1,,"Resource hijacking",TRUE,TRUE,,"Application, Runtime, Middleware, OS",,"","","","",TRUE,TRUE,TRUE,TRUE,"","","","","","T1496","Resource Hijacking",,,,,
1,,,,,,1,1,,,2,,2,1,"VM-based threats","Deployment of rogue or insecure resources",TRUE,TRUE,,"OS, Middleware, Runtime, Application",,"","","","",TRUE,TRUE,TRUE,TRUE,"","","","","","T1578.002; T1610","Create Cloud Instance; Deploy Container",,,,,
1,,,,,,1,1,,,,,0,0,"Service - attacked by cloud","Injecting additional operations",TRUE,TRUE,,"OS, Middleware, Runtime, Application",,"","","","",TRUE,TRUE,TRUE,TRUE,"","","","","","T1578.002","Modify Cloud Compute Infrastructure: Create Cloud Instance",,,,,
1,,,,,,1,1,,,,,0,0,"Cloud - attacked by service","Service requesting an excessive amount of resources and causing the exhaustion of the resources",TRUE,TRUE,,"OS, Middleware, Runtime, Application",,"","","","",TRUE,TRUE,TRUE,TRUE,"","","","","","T1499.002","Endpoint Denial of Service: Service Exhaustion Flood",,,,,
,,,,,,0,0,,,2,,2,1,"Initial access","Exploit public-facing applications",TRUE,TRUE,,"OS, Middleware, Runtime, Application",,"","","","",TRUE,TRUE,TRUE,TRUE,"","","","","","T1190","Exploit Public-Facing Application",,,,,
,,1,,,,1,1,,,,,0,0,,"XML signature attack",TRUE,TRUE,,"Application",,"","","","",TRUE,"","","","","","","","","Multiple",,,,,,
,,,,,,0,0,,,1,,1,1,"APIs","Steal application access token",TRUE,TRUE,,"Application",TRUE,"","","","",TRUE,"","","","","","","","TRUE","T1528","Steal Application Access Token",,,,,
,,,,,,0,0,,,2,,2,1,"APIs","Use alternate authentication material: Application access token",TRUE,TRUE,,"Application",TRUE,"","","","",TRUE,"","","","","","","","TRUE","T1550.001","Use Alternate Authentication Material: Application Access Token",,,,,
1,,2,,,,3,2,,,,,0,0,"Traditional security threats, Software security","Cross-site scripting (XSS)",TRUE,TRUE,,"Application",,"","","","",TRUE,"","","","","","","","","T1189","Drive-by Compromise",,,,,
2,,2,,,,4,2,1,,,,1,1,"Traditional security threats","SQL injection",TRUE,TRUE,,"Application",,"","","","",TRUE,"","","","","","","","","T1190","Exploit Public-Facing Application",,,,,
1,,,,,,1,1,,,,,0,0,,"Tampering with executable code",TRUE,TRUE,,"Application",,"","","","",TRUE,"","","","","","","","","T1577","Compromise Application Executable",,,,,
,,1,,,,1,1,,,,,0,0,,"VM rollback",TRUE,TRUE,,"OS",,"","","","","","","",TRUE,"","","","","","T1578.004","Revert Cloud Instance",,,,,
1,,,,,,1,1,,,,,0,0,,"Fingerprint VMs",TRUE,TRUE,,"OS",,"","","","","","","",TRUE,"","","","","","T1082","System Information Discovery",,,,,
,1,,,,,1,1,,,,,0,0,,"Malevolent VM making",TRUE,TRUE,,"OS",,"","","","","","","",TRUE,"","","","","","T1578.002; T1204.003","Create Cloud Instance; User Execution: Malicious Image",,,,,
,,,,,,0,0,1,,,,1,1,"Insecure Interfaces and APIs","Insufficient input validation",TRUE,,TRUE,"Application, Configuration, IAM",,TRUE,TRUE,"","",TRUE,"","","","","","","","TRUE","-",,,,,,
,,,1,,,1,1,,,,,0,0,"APIs","Insecure APIs lack proper role-based access control",TRUE,,TRUE,"Configuration, IAM",TRUE,TRUE,TRUE,"","","","","","","","","","","TRUE","-",,,,,,
,,,,,,0,0,,,1,,1,1,"Misconfigured services","Workloads run as root, or allow escalation to root",TRUE,,TRUE,"Configuration, IAM",,TRUE,TRUE,"","","","","","","","","","","TRUE","-",,,,,,
2,1,1,1,,3,8,5,1,1,,,2,2,"Mistakes in IAM","Insufficient/missing access control",TRUE,,TRUE,"IAM, Configuration",,TRUE,TRUE,"","","","","","","","","","","TRUE","-",,,,,,
3,,1,,,,4,2,1,,,,1,1,"Data security","Insufficient/missing authentication",TRUE,,TRUE,"IAM, Configuration",,TRUE,TRUE,"","","","","","","","","","","TRUE","-",,,,,,
3,,1,,,,4,2,,,,,0,0,"Data security","Insufficient/missing authorization",TRUE,,TRUE,"IAM, Configuration",,TRUE,TRUE,"","","","","","","","","","","TRUE","-",,,,,,
,,,,,,0,0,1,,,,1,1,"IAM","Self-signed certificates",TRUE,,TRUE,"IAM, Configuration",,TRUE,TRUE,"","","","","","","","","","","TRUE","-",,,,,,
,,,,,,0,0,1,,,,1,1,"IAM","Poor cryptographic management",TRUE,,TRUE,"IAM, Configuration",,TRUE,TRUE,"","","","","","","","","","","TRUE","-",,,,,,
1,,,,,,1,1,,,,,0,0,,"One-time passwords are transmitted in the clear, and the protection is guaranteed only if the attacker does not have the possibility to access passwords used in previous sessions",TRUE,,TRUE,"IAM, Configuration",,TRUE,TRUE,"","","","","","","","","","","TRUE","-",,,,,,
,1,,,,,1,1,,,,,0,0,,"Password authentication",TRUE,,TRUE,"IAM, Configuration",,TRUE,TRUE,"","","","","","","","","","","TRUE","-",,,,,,
1,,,,,,1,1,4,1,2,,7,3,"Malicious Insider attack; Misconfigurations","Excessive permissions/privileges",TRUE,,TRUE,"IAM, Configuration",,TRUE,TRUE,"","","","","","","","","","","TRUE","T1078","Valid Accounts",,,,,
,,,,,,0,0,1,,,,1,1,"Insecure Interfaces and APIs","Improper session management",TRUE,,TRUE,"IAM, Configuration",,TRUE,TRUE,"","","","","","","","","","","TRUE","-",,,,,,
,,,,,,0,0,1,,,,1,1,"Misconfigurations","ICMP left open",TRUE,,TRUE,"Configuration, Networking",,TRUE,"","",TRUE,"","","","","","","","","TRUE","-",,,,,,
,,,,,,0,0,1,,,,1,1,"Misconfigurations","Unlimited access to non-HTTPS/HTTP ports",TRUE,,TRUE,"Configuration, Networking",,TRUE,"","",TRUE,"","","","","","","","","TRUE","-",,,,,,
1,,,3,,1,5,3,5,,2,,7,2,"Lack of user control","Misconfigured services (storage/computing instances/…) and security-related settings",TRUE,,TRUE,"Configuration",,TRUE,"","","","","","","","","","","","TRUE","-",,,,,,
,1,,1,1,,3,3,1,,,,1,1,"Recovery-related issues; Data security issues; Misconfigurations","Ineffective/insecure recovery/backup techniques (lack of a good disaster recovery plan)",TRUE,,TRUE,"Configuration",,TRUE,"","","","","","","","","","","","TRUE","-",,,,,,
1,,,,,,1,1,,,,,0,0,"Key managment","Poor key managemente for encryption and decryption",TRUE,,TRUE,"Configuration",,TRUE,"","","","","","","","","","","","TRUE","T1552.004","Unsecured Credentials: Private Keys",,,,,
1,,,,,,1,1,,,,,0,0,"Misconfigurations","Omission of the cloud-init script",TRUE,,TRUE,"Configuration",,TRUE,"","","","","","","","","","","","TRUE","-",,,,,,
,,,,,,0,0,1,,,,1,1,"Insecure Interfaces and APIs","Lack of encryption",TRUE,,TRUE,"Configuration",,TRUE,"","","","","","","","","","","","TRUE","-",,,,,,
,,,,,,0,0,,,1,,1,1,"Insecure cloud provider default settings","Open databases, caches and storage buckets",TRUE,,TRUE,"Configuration",,TRUE,"","","","","","","","","","","","TRUE","T1530","Data from Cloud Storage",,,,,
,,,,,,0,0,,,1,,1,1,"Insecure cloud provider default settings","Public snapshots and images",TRUE,,TRUE,"Configuration",,TRUE,"","","","","","","","","","","","TRUE","-",,,,,,
,,,,,,0,0,,2,1,,3,2,"Insecure cloud provider default settings","Neglected cloud infrastructure / Unknown, unmanaged assets",TRUE,,TRUE,"Configuration",,TRUE,"","","","","","","","","","","","TRUE","-",,,,,,
,1,,,,,1,1,,,,,0,0,"Account hijacking / compromised accounts","View all current account actions and incoming communication",TRUE,,TRUE,"IAM",,"",TRUE,"","","","","","","","","","","TRUE","T1538; T1526; T1580","Cloud Service Dashboard; Cloud Service Discovery; Cloud Infrastructure Discovery",,,,,
,,,,,,0,0,1,,,,1,1,"Mistakes in Identity and access management (IAM)","Weak or default credentials",TRUE,,TRUE,"IAM",,"",TRUE,"","","","","","","","","","","TRUE","T1078.001; T0812; T1110","Valid Accounts: Default Accounts; Default Credentials",,,,,
1,,,,,,1,1,,,,,0,0,"Key managment","Inconsistent use of encryption keys and techniques",TRUE,,TRUE,"IAM",,"",TRUE,"","","","","","","","","","","TRUE","-",,,,,,
,,,,,,0,0,1,1,,,2,2,"Misconfigurations","Poor secret management and practices",TRUE,,TRUE,"IAM",,"",TRUE,"","","","","","","","","","","TRUE","T1555.006","Credentials from Password Stores: Cloud Secrets Management Stores",,,,,
1,,,,,,1,1,,,,,0,0,,"Data is vulnerable during transfor from data owner to DBaaS",TRUE,,TRUE,"Data, Networking",,"","",TRUE,TRUE,"","","","","","","","","",,,,,,,
,,1,,,,1,1,,,,,0,0,"APIs","Data outflow from insecure APIs",TRUE,,TRUE,"Application, Data",TRUE,"","",TRUE,"",TRUE,"","","","","","","","TRUE","T1530; T1190; T1552.005","Data from Cloud Storage; Exploit Public-Facing Application; Unsecured Credentials: Cloud Instance Metadata API",,,,,
1,,,,1,,2,2,,,,,0,0,"Image sharing","Insecure or incomplete data deletion",TRUE,,TRUE,"Data",,"","",TRUE,"","","","","","","","","","",,,,,,,
3,2,,,1,,6,3,1,3,,1,5,3,"API-associated risks","Insecure interfaces and APIs",TRUE,,TRUE,"OS, Middleware, Runtime, Application",TRUE,"","","","",TRUE,TRUE,TRUE,TRUE,"","","","","TRUE","T1190","Exploit Public-Facing Application",,,,,
1,,,,,,1,1,,1,,,1,1,,"Presence of insecure and tampered workload images",TRUE,,TRUE,"OS, Middleware, Runtime, Application",,"","","","",TRUE,TRUE,TRUE,TRUE,"","","","","",,,,,,,
,1,1,,,,2,2,6,,0,,6,2,,"Software/application flaws (e.g. unpatched software)",TRUE,,TRUE,"Application",,"","","","",TRUE,"","","","","","","","",,,,,,,
,,,,,1,1,1,,,,,0,0,,"Connectivity with cloud services",TRUE,,TRUE,,,"","","","","","","","","","","","","",,,,,,,TRUE
1,,,,,,1,1,,,,,0,0,"Reason for risk","Lack of confidentiality protection for data in transit in unsage oruntrusted WiFi or cellular networks",TRUE,,,"Networking, Data, Configuration",,TRUE,"",TRUE,TRUE,"","","","","","","","","TRUE","-",,,,,,
,,,,,,0,0,,,,1,1,1,,"Accidental exposure of credentials",TRUE,,,"Configuration",,TRUE,"","","","","","","","","","","","TRUE","-",,,,,,
1,,,,,,1,1,,,,,0,0,"Reason for risk","Acceptace of fake mobility management profiles",TRUE,,,"IAM",,"",TRUE,"","","","","","","","","","","TRUE","-",,,,,,
1,,,,,,1,1,,,,,0,0,,"Multiple hardware and/or software failures lead to inconsistent views of user data",TRUE,,,,,"","","","","","","","","","","","","",,,,,,,
1,,,,,,1,1,,,,,0,0,"Service - attacked by cloud","Privilege-related attacks",TRUE,TRUE,,"IAM",,"",TRUE,"","","","","","","","","","","TRUE","Multiple",,TRUE,,,,
1,,,,,,1,1,,,,,0,0,"APIs","Hacked interfaces and APIs",TRUE,TRUE,,"Application",TRUE,"","","","",TRUE,"","","","","","","","TRUE","T1059.009","Command and Scripting Interpreter: Cloud API",TRUE,,,,
1,,,,,,1,1,,,,,0,0,,"Web app attacks",TRUE,TRUE,,"Application",,"","","","",TRUE,"","","","","","","","","T1190","Exploit Public-Facing Application",TRUE,,,,
,,,,,,0,0,,,2,,2,1,,"Lateral movement",TRUE,TRUE,,,,"","","","","","","","","","","","","","TA0008","Lateral Movement",TRUE,,,,
2,,1,,,,3,2,,,,1,1,1,,"Attacks from external entities / outsider attacks",TRUE,TRUE,,,,"","","","","","","","","","","","","","None",,TRUE,,,,
2,,,,,,2,1,,,,,0,0,"Privacy concern","Identity theft",TRUE,TRUE,,,,"","","","","","","","","","","","","","None",,TRUE,,,,
8,3,1,,1,2,15,5,,1,,1,2,2,"Breach of security","Malicious Insider attack",TRUE,TRUE,,,,"","","","","","","","","","","","","","T1078","Valid Accounts",TRUE,,,,
,,,,,,0,0,,,8,,8,1,,"Discovery",TRUE,TRUE,,,,"","","","","","","","","","","","","","TA0007","Discovery",TRUE,,,,
,,,,,,0,0,,,,1,1,1,"Discovery","Cloud asset discovery",TRUE,TRUE,,,,,,,,,"","","","","","","","",,,TRUE,,,,
,,,,,,0,0,,,1,,1,1,,"Defense evasion",TRUE,TRUE,,,,"","","","","","","","","","","","","","TA0005","Defense evation",TRUE,,,,
,,,,,,0,0,,,1,,1,1,,"Initial access",TRUE,TRUE,,,,"","","","","","","","","","","","","","TA0001","Initial Access",TRUE,,,,
,,,,1,,1,1,2,1,3,,6,3,,"Mistakes in Identity and access management (IAM)",TRUE,,TRUE,"IAM, Configuration",,TRUE,TRUE,"","","","","","","","","","","TRUE",,,TRUE,,,,
,,,,,,0,0,,1,,,1,1,,"Secret exposures",TRUE,,,"IAM",,"",TRUE,"","","","","","","","","","","TRUE",,,TRUE,,,,
1,,,,,1,2,2,,,,,0,0,,"Threats related to system availability",TRUE,,,,,"","","","","","","","","","","","","",,,TRUE,,,,
,,1,,,,1,1,,,,,0,0,,"Authentication attacks",TRUE,TRUE,,"IAM",,"",TRUE,"","","","","","","","","","","TRUE","Multiple",,TRUE,,,,
1,1,,,,2,4,3,,,2,,2,1,"Malicious Insider attack","Privilege escalation",TRUE,TRUE,,"IAM",,"",TRUE,"","","","","","","","","","","TRUE","TA0004","Privilege Escalation",TRUE,,,,
,,1,,,,1,1,,,,,0,0,,"Web or browser security attack",TRUE,TRUE,,"Networking",,"","","",TRUE,"","","","","","","","","","None",,TRUE,,,,
3,1,,1,,,5,3,,,,,0,0,"Threats related to third-party data control","Unknown threats due to lack of transparency",TRUE,,,"None",,"","","","","","","","","","","","","","None",,TRUE,,,,
,2,,,,2,4,2,,1,,,1,1,"APTs","Social engineering attacks",TRUE,TRUE,,"IAM",,"",TRUE,"","","","","","","","","","","TRUE","T1566","Phishing",TRUE,,,,
2,1,,,,,3,2,,,6,,6,1,"Malicious Insider attack; Misconfigurations","Misuse of (superuser) privileges",TRUE,TRUE,,"IAM",,TRUE,TRUE,"","","","","","","","","","","TRUE","T1078","Valid Accounts",TRUE,,,,
,,,4,,,4,1,,,,,0,0,"Hypervisor-based threats","Exploit vulnerability/bug in virtualization software (to access other virtual network)",TRUE,TRUE,TRUE,"Virtualization",,"","","","","","","","",TRUE,"","","","",,,,TRUE,,,
7,,1,1,,1,10,4,,1,,1,2,2,,"Third-party access / Unauthorized access to data and privileged information",TRUE,TRUE,TRUE,,,"","","","","","","","","","","","","",,,,TRUE,,,
,,,1,,,1,1,,,,,0,0,"Virtualization and hypervisor related attacks","VM sprawl (remains out of date for security updates)",TRUE,TRUE,,"Virtualization, OS",,"","","","","","","",TRUE,TRUE,"","","","",,,,TRUE,,,
,,,1,,,1,1,,,,,0,0,"Virtualization and hypervisor related attacks","VM theft",TRUE,TRUE,,"Virtualization, OS",,"","","","","","","",TRUE,TRUE,"","","","",,,,TRUE,,,
,1,1,2,,,4,3,,,,,0,0,"Virtualization and hypervisor related attacks","VM escape / Cross VM attack",TRUE,TRUE,,"Virtualization, OS",,"","","","","","","",TRUE,TRUE,"","","","",,,,TRUE,,,
3,,,,,,3,1,,,,,0,0,"Hypervisor-based threats","Buffer overflow attacks",TRUE,TRUE,,"Virtualization",,"","","","","","","","",TRUE,"","","","",,,,TRUE,,,
1,,,1,,,2,2,,,,,0,0,"Hypervisor-based threats","(Cross-) VM side-channel attacks",TRUE,TRUE,,"Virtualization",,"","","","","","","","",TRUE,"","","","",,,,TRUE,,,
,1,,,,,1,1,,,,,0,0,,"Data alteration",TRUE,TRUE,,"Virtualization",,"","","","","","","","",TRUE,"","","","",,,,TRUE,,,
,,,1,,,1,1,,,,,0,0,"Hypervisor-based threats","Hyperjacking (attacker takes control over the hypervisor)",TRUE,TRUE,,"Virtualization",,"","","","","","","","",TRUE,"","","","",,,,TRUE,,,
1,,,,,,1,1,,,,,0,0,"Hypervisor-based threats","Resource starvation for some VMs",TRUE,TRUE,,"Virtualization",,"","","","","","","","",TRUE,"","","","",,,,TRUE,,,
,1,,1,,,2,2,,,,,0,0,"Virtualization and hypervisor related attacks","VM hopping",TRUE,TRUE,,"Virtualization",,"","","","","","","","",TRUE,"","","","",,,,TRUE,,,
1,,1,,,,2,2,,,,,0,0,,"Physical theft",TRUE,TRUE,,"Physical security",,"","","","","","","","","","","",TRUE,"",,,,TRUE,,,
1,,,,,,1,1,,,,,0,0,"Threats related to third-party data control","Cloud provider espionage",TRUE,TRUE,,,,"","","","","","","","","","","","","",,,,TRUE,,,
1,,,,,,1,1,,,,,0,0,"Service - attacked by cloud","Limiting access to resources",TRUE,TRUE,,,,"","","","","","","","","","","","","",,,,TRUE,,,
4,2,,1,,1,8,4,1,,,,1,1,,"Multitenancy / Shared technology",TRUE,,TRUE,"Virtualization",,"","","","","","","","",TRUE,"","","","","None",,,TRUE,,,
,,,1,,,1,1,,,,,0,0,,"Host in a multi-tenant environment becomes vulnerable to security attack (vulnerable host)",TRUE,,TRUE,"Virtualization",,"","","","","","","","",TRUE,"","","","",,,,TRUE,,,
1,,,,,,1,1,,,,,0,0,,"Inability to establish the provenance of the data",TRUE,,,"Data",,"","",TRUE,"","","","","","","","","","",,,,TRUE,,,
1,,,,,,1,1,,,,,0,0,,"System failures",TRUE,,,"Virtualization, Servers, Storage, Physical Security",,"","","","","","","","",TRUE,TRUE,TRUE,TRUE,"",,,,TRUE,,,
,,,1,,,1,1,,,,,0,0,"Hypervisor-based threats","Hypervisor failure",TRUE,,,"Virtualization",,"","","","","","","","",TRUE,"","","","",,,,TRUE,,,
1,1,,,,,2,2,,,,,0,0,,"Hardware failures",TRUE,,,"Physical security",,"","","","","","","","","","","",TRUE,"",,,,TRUE,,,
1,1,,,,,2,2,,,,,0,0,,"Natural disasters",TRUE,,,"Physical security",,"","","","","","","","","","","",TRUE,"",,,,TRUE,,,
1,,,,,,1,1,,,,,0,0,,"Other catastrophic events",TRUE,,,"Physical security",,"","","","","","","","","","","",TRUE,"",,,,TRUE,,,
,1,,,,,1,1,,,,,0,0,,"Physical interruption of resources (In less secure locations or distant practices, insiders or external attackers can physically interrupt resources with relative ease)",TRUE,,,"Physical security",,"","","","","","","","","","","",TRUE,"",,,,TRUE,,,
1,,,,,,1,1,,,,,0,0,,"Power outages",TRUE,,,"Physical security",,"","","","","","","","","","","",TRUE,"",,,,TRUE,,,
1,,,,,,1,1,1,,,,1,1,"Interoperability and standardization","Vendor lockin",TRUE,,,,,"","","","","","","","","","","","","",,,,TRUE,,,
2,,,,,,2,1,,,,,0,0,"Recovery-related issues","Illegal data recovery from storage (devices)",TRUE,TRUE,,"Storage, Data",,"","",TRUE,"","","","","","","",TRUE,"","","T1530","Data from Cloud Storage",,TRUE,,,
,1,,,,,1,1,,,,,0,0,"Malicious attempts","Browser hijacking",TRUE,TRUE,TRUE,"Application",,"","","","",TRUE,"","","","","","","","","T1185","Browser Session Hijacking",,,TRUE,,TRUE
1,,,,,,1,1,,,,,0,0,"User - attacked by service","Attacks on browser caches",TRUE,TRUE,,"Application",,"","","","",TRUE,"","","","","","","","","T1217","Browser Information Discovery",,,TRUE,,TRUE
1,,,,,,1,1,,,,,0,0,"Reason for risk","Misuse or misconfiguration of location services, such as GPS",TRUE,TRUE,,"Configuration",,TRUE,"","","","","","","","","","","","TRUE","T1583.006","Acquire Infrastructure: Web Services",,,TRUE,,TRUE
,,,,,,0,0,,,1,,1,1,"Defense evasion","Masquerade as valid users by choosing proxy exits close to expected victim locations",TRUE,TRUE,,"IAM",,"",TRUE,"","","","","","","","","","","TRUE","T1090","Proxy",,,TRUE,,
1,,,,,,1,1,,,,,0,0,"Network security","Electronic tracking",TRUE,TRUE,,"Networking",,"","","",TRUE,"","","","","","","","","","T1430","Location Tracking",,,TRUE,,TRUE
1,,,,,,1,1,,,,,0,0,"Reason for risk","Enabling smudge attacks",TRUE,TRUE,,,,"","","","","","","","","","","","","","T1056","Input Capture",,,TRUE,,TRUE
1,1,,,,,2,2,,,,,0,0,"Malware","Spyware",TRUE,TRUE,,"OS, Middleware, Runtime, Application",,"","","","",TRUE,TRUE,TRUE,TRUE,"","","","","","T1204.002","User Execution: Malicious File",,,,TRUE,
1,,,,,1,2,2,,,,,0,0,"Malware","Trojans",TRUE,TRUE,,"OS, Middleware, Runtime, Application",,"","","","",TRUE,TRUE,TRUE,TRUE,"","","","","","T1204.002","User Execution: Malicious File",,,,TRUE,
